{"schema":"kofun.bench-report/v1","identity":{"suite":"\\\\\\\\\\\\\\\\\\\\\\\\\\\\\\\\\\\\\\\\\\\\\\\\\\\\\\\\\\\\\\\\\\\\\\\\\\\\\\\\\\\\\\\\\\\\\\\\\\\\\\\\\\\\\\\\\\\\\\\\\\\\\\\\\\\\\\\\\\\\\\\\\\\\\\\\\\\\\\\\\\\\\\\\\\\\\\\\\\\\\\\\\\\\\\\\","case":"\"\"\"\"\"\"\"\"\"\"\"\"\"\"\"\"\"\"\"\"\"\"\"\"\"\"\"\"\"\"\"\"\"\"\"\"\"\"\"\"\"\"\"\"\"\"\"\"\"\"\"\"\"\"\"\"\"\"\"\"\"\"\"\"\"\"\"\"\"\"\"\"\"\"\"\"\"\"\"\"\"\"\"\"\"\"\"\"\"\"\"\"\"\"\"\"","parameter":"\\\"\\\"\\\"\\\"\\\"\\\"\\\"\\\"\\\"\\\"\\\"\\\"\\\"\\\"\\\"\\\"\\\"\\\"\\\"\\\"\\\"\\\"\\\"\\\"\\\"\\\"\\\"\\\"\\\"\\\"\\\"\\\"\\\"\\\"\\\"\\\"\\\"\\\"\\\"\\\"\\\"\\\"\\\"\\\"\\\"\\\"\\\"\\\"","metric":"\\\\\\\\\\\\\\\\\\\\\\\\\\\\\\\\\\\\\\\\\\\\\\\\\\\\\\\\\\\\\\\\\\\\\\\\\\\\\\\\\\\\\\\\\\\\\\\\\\\\\\\\\\\\\\\\\\\\\\\\\\\\\\\\\\\\\\\\\\\\\\\\\\\\\\\\\\\\\\\\\\\\\\\\\\\\\\\\\\\\\\\\\\\\\\\\","unit":"ns","direction":"lower-is-better"},"clock":"wall","budget":{"warmup_cap_ns":500000000,"sampling_cap_ns":3000000000,"sample_cap":100},"measurement":{"warmup_iterations":9007199254740991,"warmup_stop":"steady","iterations_per_sample":9007199254740991,"sample_count":100,"sampling_stop":"sample-cap","harness_overhead_ns":9007199254740991},"samples":[9007199254740990,9007199254740990,9007199254740990,9007199254740990,9007199254740990,9007199254740990,9007199254740990,9007199254740990,9007199254740990,9007199254740990,9007199254740990,9007199254740990,9007199254740990,9007199254740990,9007199254740990,9007199254740990,9007199254740990,9007199254740990,9007199254740990,9007199254740990,9007199254740990,9007199254740990,9007199254740990,9007199254740990,9007199254740990,9007199254740990,9007199254740990,9007199254740990,9007199254740990,9007199254740990,9007199254740990,9007199254740990,9007199254740990,9007199254740990,9007199254740990,9007199254740990,9007199254740990,9007199254740990,9007199254740990,9007199254740990,9007199254740990,9007199254740990,9007199254740990,9007199254740990,9007199254740990,9007199254740990,9007199254740990,9007199254740990,9007199254740990,9007199254740990,9007199254740990,9007199254740990,9007199254740990,9007199254740990,9007199254740990,9007199254740990,9007199254740990,9007199254740990,9007199254740990,9007199254740990,9007199254740990,9007199254740990,9007199254740990,9007199254740990,9007199254740990,9007199254740990,9007199254740990,9007199254740990,9007199254740990,9007199254740990,9007199254740990,9007199254740990,9007199254740990,9007199254740990,9007199254740990,9007199254740990,9007199254740990,9007199254740990,9007199254740990,9007199254740990,9007199254740990,9007199254740990,9007199254740990,9007199254740990,9007199254740990,9007199254740990,9007199254740990,9007199254740990,9007199254740990,9007199254740990,9007199254740990,9007199254740990,9007199254740990,9007199254740990,9007199254740990,9007199254740990,9007199254740990,9007199254740990,9007199254740990,9007199254740991],"outliers":[false,false,false,false,false,false,false,false,false,false,false,false,false,false,false,false,false,false,false,false,false,false,false,false,false,false,false,false,false,false,false,false,false,false,false,false,false,false,false,false,false,false,false,false,false,false,false,false,false,false,false,false,false,false,false,false,false,false,false,false,false,false,false,false,false,false,false,false,false,false,false,false,false,false,false,false,false,false,false,false,false,false,false,false,false,false,false,false,false,false,false,false,false,false,false,false,false,false,false,true],"summary":{"minimum":9007199254740990,"maximum":9007199254740991,"median":9007199254740990,"p25":9007199254740990,"p75":9007199254740990,"median_absolute_deviation":0},"counters":{"allocated_bytes":{"state":"available","value":9007199254740991},"allocation_count":{"state":"available","value":9007199254740991},"gc_collections":{"state":"available","value":9007199254740991},"vm_peak_bytes":{"state":"available","value":9007199254740991},"cpu_cycles":{"state":"available","value":9007199254740991}},"digests":{"toolchain_sha256":"ffffffffffffffffffffffffffffffffffffffffffffffffffffffffffffffff","source_sha256":"eeeeeeeeeeeeeeeeeeeeeeeeeeeeeeeeeeeeeeeeeeeeeeeeeeeeeeeeeeeeeeee","artifact_sha256":"dddddddddddddddddddddddddddddddddddddddddddddddddddddddddddddddd"},"host":{"host_id_sha256":"dddddddddddddddddddddddddddddddddddddddddddddddddddddddddddddddd","os":"\\\\\\\\\\\\\\\\\\\\\\\\\\\\\\\\\\\\\\\\\\\\\\\\\\\\\\\\\\\\\\\\\\\\\\\\\\\\\\\\\\\\\\\\\\\\\\\\\\\\\\\\\\\\\\\\\\\\\\\\\\\\\\\\\\\\\\\\\\\\\\\\\\\\\\\\\\\\\\\\\\\\\\\\\\\\\\\\\\\\\\\\\\\\\\\\\\\\\\\\\\\\\\\\\\\\\\\\\\\\\\\\\\\\\\\\\\\\\\\\\\\\\\\\\\\\\\\\","arch":"\"\"\"\"\"\"\"\"\"\"\"\"\"\"\"\"\"\"\"\"\"\"\"\"\"\"\"\"\"\"\"\"\"\"\"\"\"\"\"\"\"\"\"\"\"\"\"\"\"\"\"\"\"\"\"\"\"\"\"\"\"\"\"\"\"\"\"\"\"\"\"\"\"\"\"\"\"\"\"\"\"\"\"\"\"\"\"\"\"\"\"\"\"\"\"\"\"\"\"\"\"\"\"\"\"\"\"\"\"\"\"\"\"\"\"\"\"\"\"\"\"\"\"\"\"\"\"\"","cpu":"\\\"\\\"\\\"\\\"\\\"\\\"\\\"\\\"\\\"\\\"\\\"\\\"\\\"\\\"\\\"\\\"\\\"\\\"\\\"\\\"\\\"\\\"\\\"\\\"\\\"\\\"\\\"\\\"\\\"\\\"\\\"\\\"\\\"\\\"\\\"\\\"\\\"\\\"\\\"\\\"\\\"\\\"\\\"\\\"\\\"\\\"\\\"\\\"\\\"\\\"\\\"\\\"\\\"\\\"\\\"\\\"\\\"\\\"\\\"\\\"\\\"\\\"\\\"\\\"","affinity":{"state":"available","value":"\"\\\"\\\"\\\"\\\"\\\"\\\"\\\"\\\"\\\"\\\"\\\"\\\"\\\"\\\"\\\"\\\"\\\"\\\"\\\"\\\"\\\"\\\"\\\"\\\"\\\"\\\"\\\"\\\"\\\"\\\"\\\"\\\"\\\"\\\"\\\"\\\"\\\"\\\"\\\"\\\"\\\"\\\"\\\"\\\"\\\"\\\"\\\"\\\"\\\"\\\"\\\"\\\"\\\"\\\"\\\"\\\"\\\"\\\"\\\"\\\"\\\"\\\"\\\"\\"},"frequency_hz":{"state":"available","value":9007199254740991},"noise":"\t\n\r\"\\\t\n\r\"\\\t\n\r\"\\\t\n\r\"\\\t\n\r\"\\\t\n\r\"\\\t\n\r\"\\\t\n\r\"\\\t\n\r\"\\\t\n\r\"\\\t\n\r\"\\\t\n\r\"\\\t\n\r\"\\\t\n\r\"\\\t\n\r\"\\\t\n\r\"\\\t\n\r\"\\\t\n\r\"\\\t\n\r\"\\\t\n\r\"\\\t\n\r\"\\\t\n\r\"\\\t\n\r\"\\\t\n\r\"\\\t\n\r\"\\\t\n\r\"\\\t\n\r\"\\\t\n\r\"\\\t\n\r\"\\\t\n\r\"\\\t\n\r\"\\\t\n\r\"\\\t\n\r\"\\\t\n\r\"\\\t\n\r\"\\\t\n\r\"\\\t\n\r\"\\\t\n\r\"\\\t\n\r\"\\\t\n\r\"\\\t\n\r\"\\\t\n\r\"\\\t\n\r\"\\\t\n\r\"\\\t\n\r\"\\\t\n\r\"\\\t\n\r\"\\\t\n\r\"\\\t\n\r\"\\\t\n\r\"\\\t\n\r\"\\"}}
