{"schema":"kofun.bench-report/v1","identity":{"suite":"s","case":"c","metric":"duration","unit":"ns","direction":"lower-is-better"},"clock":"monotonic","budget":{"warmup_cap_ns":0,"sampling_cap_ns":1,"sample_cap":1},"measurement":{"warmup_iterations":0,"warmup_stop":"disabled","iterations_per_sample":1,"sample_count":1,"sampling_stop":"sample-cap","harness_overhead_ns":0},"samples":[0],"outliers":[false],"summary":{"minimum":0,"maximum":0,"median":0,"p25":0,"p75":0,"median_absolute_deviation":0},"counters":{"allocated_bytes":{"state":"unavailable"},"allocation_count":{"state":"unavailable"},"gc_collections":{"state":"unavailable"},"vm_peak_bytes":{"state":"unavailable"},"cpu_cycles":{"state":"unavailable"}},"digests":{"toolchain_sha256":"aaaaaaaaaaaaaaaaaaaaaaaaaaaaaaaaaaaaaaaaaaaaaaaaaaaaaaaaaaaaaaaa","source_sha256":"bbbbbbbbbbbbbbbbbbbbbbbbbbbbbbbbbbbbbbbbbbbbbbbbbbbbbbbbbbbbbbbb","artifact_sha256":"cccccccccccccccccccccccccccccccccccccccccccccccccccccccccccccccc"},"host":{"host_id_sha256":"dddddddddddddddddddddddddddddddddddddddddddddddddddddddddddddddd","os":"unknown","arch":"unknown","cpu":"unknown","affinity":{"state":"unavailable"},"frequency_hz":{"state":"unavailable"},"noise":""}}
