{"schema":"kofun.bench-report/v1","identity":{"suite":"古墳-suite","case":"escape-\"quote\"-\\slash","parameter":"café-サイズ大","metric":"duration","unit":"ns","direction":"lower-is-better"},"clock":"process-cpu","budget":{"warmup_cap_ns":500000000,"sampling_cap_ns":3000000000,"sample_cap":10},"measurement":{"warmup_iterations":21,"warmup_stop":"steady","iterations_per_sample":4,"sample_count":8,"sampling_stop":"time-cap","harness_overhead_ns":2},"samples":[41,7,19,3,23,11,29,17],"outliers":[false,false,false,false,false,false,false,false],"summary":{"minimum":3,"maximum":41,"median":17,"p25":7,"p75":23,"median_absolute_deviation":6},"counters":{"allocated_bytes":{"state":"available","value":0},"allocation_count":{"state":"available","value":7},"gc_collections":{"state":"unavailable"},"vm_peak_bytes":{"state":"available","value":4096},"cpu_cycles":{"state":"unavailable"}},"digests":{"toolchain_sha256":"0123456789abcdef0123456789abcdef0123456789abcdef0123456789abcdef","source_sha256":"1111111111111111111111111111111111111111111111111111111111111111","artifact_sha256":"2222222222222222222222222222222222222222222222222222222222222222"},"host":{"host_id_sha256":"3333333333333333333333333333333333333333333333333333333333333333","os":"linux","arch":"x86_64","cpu":"deterministic fixture CPU","affinity":{"state":"available","value":"0-3"},"frequency_hz":{"state":"available","value":3200000000},"noise":"scheduler \"quiet\"\\stable\n観測"}}
